{
  "$id": "semiocore.biomed.plasticity2_report.v1",
  "$schema": "https://json-schema.org/draft/2020-12/schema",
  "type": "object",
  "additionalProperties": false,
  "properties": {
    "schema": {"const": "semiocore.biomed.plasticity2_report.v1"},
    "provenance": {
      "type": "object",
      "additionalProperties": false,
      "properties": {
        "tool_version": {"type": "string"},
        "created_utc": {"type": "string"},
        "evidence_hash": {"type": "string"}
      },
      "required": ["tool_version", "created_utc", "evidence_hash"]
    },
    "recipe": {"type": "string"},
    "sigma": {
      "type": "array",
      "items": {
        "type": "object",
        "additionalProperties": false,
        "properties": {
          "label": {"type": "string"},
          "hours": {"type": "number"},
          "D": {"type": "number"},
          "T": {"type": "number"},
          "R": {"type": "number"},
          "C": {"type": ["number", "null"]}
        },
        "required": ["label", "hours", "D", "T", "R", "C"]
      }
    },
    "metrics": {
      "type": "object",
      "additionalProperties": false,
      "properties": {
        "D_peak": {"type": "number"},
        "t_peak_hours": {"type": "number"},
        "t_recover_80_hours": {"type": ["number", "null"]},
        "auc_D": {"type": "number"},
        "mean_R": {"type": "number"},
        "mean_C": {"type": ["number", "null"]}
      },
      "required": ["D_peak", "t_peak_hours", "t_recover_80_hours", "auc_D", "mean_R", "mean_C"]
    }
  },
  "required": ["schema", "provenance", "recipe", "sigma", "metrics"]
}
